{
  "version": "1.0.0",
  "page_info": {
    "width_mm": 210,
    "height_mm": 297,
    "dpi": 300,
    "page_size": "A4",
    "orientation": "portrait"
  },
  "registration_marks": [
    {
      "id": "top_left",
      "x_mm": 10,
      "y_mm": 10,
      "type": "circle",
      "size_mm": 5,
      "fill": true
    },
    {
      "id": "top_right",
      "x_mm": 200,
      "y_mm": 10,
      "type": "circle",
      "size_mm": 5,
      "fill": true
    },
    {
      "id": "bottom_left",
      "x_mm": 10,
      "y_mm": 287,
      "type": "circle",
      "size_mm": 5,
      "fill": true
    },
    {
      "id": "bottom_right",
      "x_mm": 200,
      "y_mm": 287,
      "type": "circle",
      "size_mm": 5,
      "fill": true
    }
  ],
  "id_fields": {
    "version_id": {
      "x_mm": 20,
      "y_mm": 20,
      "width_mm": 40,
      "height_mm": 10,
      "type": "barcode"
    },
    "student_id": {
      "x_mm": 160,
      "y_mm": 20,
      "width_mm": 40,
      "height_mm": 10,
      "type": "barcode"
    }
  },
  "questions": [
    {
      "question_id": "q1",
      "type": "multiple_choice",
      "page": 1,
      "answer_region": {
        "x_mm": 25,
        "y_mm": 80,
        "width_mm": 80,
        "height_mm": 30
      },
      "answer_fields": [
        {
          "label": "A",
          "x_mm": 30,
          "y_mm": 85,
          "field_type": "circle",
          "radius_mm": 3
        },
        {
          "label": "B",
          "x_mm": 30,
          "y_mm": 93,
          "field_type": "circle",
          "radius_mm": 3
        },
        {
          "label": "C",
          "x_mm": 30,
          "y_mm": 101,
          "field_type": "circle",
          "radius_mm": 3
        },
        {
          "label": "D",
          "x_mm": 30,
          "y_mm": 109,
          "field_type": "circle",
          "radius_mm": 3
        }
      ]
    },
    {
      "question_id": "q2",
      "type": "multiple_choice",
      "page": 1,
      "answer_region": {
        "x_mm": 25,
        "y_mm": 120,
        "width_mm": 80,
        "height_mm": 30
      },
      "answer_fields": [
        {
          "label": "A",
          "x_mm": 30,
          "y_mm": 125,
          "field_type": "circle",
          "radius_mm": 3
        },
        {
          "label": "B",
          "x_mm": 30,
          "y_mm": 133,
          "field_type": "circle",
          "radius_mm": 3
        },
        {
          "label": "C",
          "x_mm": 30,
          "y_mm": 141,
          "field_type": "circle",
          "radius_mm": 3
        },
        {
          "label": "D",
          "x_mm": 30,
          "y_mm": 149,
          "field_type": "circle",
          "radius_mm": 3
        }
      ]
    },
    {
      "question_id": "q3",
      "type": "short_answer",
      "page": 1,
      "answer_region": {
        "x_mm": 25,
        "y_mm": 160,
        "width_mm": 160,
        "height_mm": 15
      },
      "ocr_region": {
        "x_mm": 25,
        "y_mm": 160,
        "width_mm": 160,
        "height_mm": 15,
        "expected_lines": 1
      }
    },
    {
      "question_id": "q4",
      "type": "multiple_choice",
      "page": 1,
      "answer_region": {
        "x_mm": 25,
        "y_mm": 185,
        "width_mm": 80,
        "height_mm": 30
      },
      "answer_fields": [
        {
          "label": "A",
          "x_mm": 30,
          "y_mm": 190,
          "field_type": "circle",
          "radius_mm": 3
        },
        {
          "label": "B",
          "x_mm": 30,
          "y_mm": 198,
          "field_type": "circle",
          "radius_mm": 3
        },
        {
          "label": "C",
          "x_mm": 30,
          "y_mm": 206,
          "field_type": "circle",
          "radius_mm": 3
        },
        {
          "label": "D",
          "x_mm": 30,
          "y_mm": 214,
          "field_type": "circle",
          "radius_mm": 3
        }
      ]
    },
    {
      "question_id": "q5",
      "type": "short_answer",
      "page": 1,
      "answer_region": {
        "x_mm": 25,
        "y_mm": 225,
        "width_mm": 160,
        "height_mm": 15
      },
      "ocr_region": {
        "x_mm": 25,
        "y_mm": 225,
        "width_mm": 160,
        "height_mm": 15,
        "expected_lines": 1
      }
    }
  ],
  "fill_detection": {
    "threshold": 0.6,
    "noise_tolerance": "standard",
    "edge_detection": true
  }
}
