{
  "version": "1.0.0",
  "page_info": {
    "width_mm": 210,
    "height_mm": 297,
    "dpi": 300,
    "page_size": "A4",
    "orientation": "portrait"
  },
  "registration_marks": [
    {
      "id": "top_left",
      "x_mm": 10,
      "y_mm": 10,
      "type": "circle",
      "size_mm": 5,
      "fill": true
    },
    {
      "id": "top_right",
      "x_mm": 200,
      "y_mm": 10,
      "type": "circle",
      "size_mm": 5,
      "fill": true
    },
    {
      "id": "bottom_left",
      "x_mm": 10,
      "y_mm": 287,
      "type": "circle",
      "size_mm": 5,
      "fill": true
    },
    {
      "id": "bottom_right",
      "x_mm": 200,
      "y_mm": 287,
      "type": "circle",
      "size_mm": 5,
      "fill": true
    }
  ],
  "id_fields": {
    "version_id": {
      "x_mm": 20,
      "y_mm": 20,
      "width_mm": 40,
      "height_mm": 10,
      "type": "barcode"
    },
    "student_id": {
      "x_mm": 150,
      "y_mm": 20,
      "width_mm": 40,
      "height_mm": 10,
      "type": "barcode"
    }
  },
  "questions": [
    {
      "question_id": "RAM",
      "type": "short_answer",
      "page": 1,
      "answer_region": {
        "x_mm": 25,
        "y_mm": 80,
        "width_mm": 160,
        "height_mm": 20
      },
      "ocr_region": {
        "x_mm": 25,
        "y_mm": 80,
        "width_mm": 160,
        "height_mm": 15,
        "expected_lines": 1
      }
    },
    {
      "question_id": "Binary_Search",
      "type": "multiple_choice",
      "page": 1,
      "answer_region": {
        "x_mm": 25,
        "y_mm": 105,
        "width_mm": 160,
        "height_mm": 20
      },
      "answer_fields": [
        {
          "label": "A",
          "x_mm": 30,
          "y_mm": 115,
          "field_type": "circle",
          "radius_mm": 3
        },
        {
          "label": "B",
          "x_mm": 50,
          "y_mm": 115,
          "field_type": "circle",
          "radius_mm": 3
        },
        {
          "label": "C",
          "x_mm": 70,
          "y_mm": 115,
          "field_type": "circle",
          "radius_mm": 3
        },
        {
          "label": "D",
          "x_mm": 90,
          "y_mm": 115,
          "field_type": "circle",
          "radius_mm": 3
        }
      ]
    },
    {
      "question_id": "Singleton",
      "type": "short_answer",
      "page": 1,
      "answer_region": {
        "x_mm": 25,
        "y_mm": 130,
        "width_mm": 160,
        "height_mm": 20
      },
      "ocr_region": {
        "x_mm": 25,
        "y_mm": 130,
        "width_mm": 160,
        "height_mm": 15,
        "expected_lines": 1
      }
    },
    {
      "question_id": "Encapsulation",
      "type": "multiple_choice",
      "page": 1,
      "answer_region": {
        "x_mm": 25,
        "y_mm": 155,
        "width_mm": 160,
        "height_mm": 20
      },
      "answer_fields": [
        {
          "label": "A",
          "x_mm": 30,
          "y_mm": 165,
          "field_type": "circle",
          "radius_mm": 3
        },
        {
          "label": "B",
          "x_mm": 50,
          "y_mm": 165,
          "field_type": "circle",
          "radius_mm": 3
        },
        {
          "label": "C",
          "x_mm": 70,
          "y_mm": 165,
          "field_type": "circle",
          "radius_mm": 3
        },
        {
          "label": "D",
          "x_mm": 90,
          "y_mm": 165,
          "field_type": "circle",
          "radius_mm": 3
        }
      ]
    },
    {
      "question_id": "Full_Binary_Tree",
      "type": "true_false",
      "page": 1,
      "answer_region": {
        "x_mm": 25,
        "y_mm": 180,
        "width_mm": 160,
        "height_mm": 20
      },
      "answer_fields": [
        {
          "label": "A",
          "x_mm": 30,
          "y_mm": 190,
          "field_type": "circle",
          "radius_mm": 3
        },
        {
          "label": "B",
          "x_mm": 50,
          "y_mm": 190,
          "field_type": "circle",
          "radius_mm": 3
        }
      ]
    },
    {
      "question_id": "Merge_Sort",
      "type": "short_answer",
      "page": 1,
      "answer_region": {
        "x_mm": 25,
        "y_mm": 205,
        "width_mm": 160,
        "height_mm": 20
      },
      "ocr_region": {
        "x_mm": 25,
        "y_mm": 205,
        "width_mm": 160,
        "height_mm": 15,
        "expected_lines": 1
      }
    },
    {
      "question_id": "HTTP_Methods",
      "type": "multiple_choice",
      "page": 1,
      "answer_region": {
        "x_mm": 25,
        "y_mm": 230,
        "width_mm": 160,
        "height_mm": 20
      },
      "answer_fields": [
        {
          "label": "A",
          "x_mm": 30,
          "y_mm": 240,
          "field_type": "circle",
          "radius_mm": 3
        },
        {
          "label": "B",
          "x_mm": 50,
          "y_mm": 240,
          "field_type": "circle",
          "radius_mm": 3
        },
        {
          "label": "C",
          "x_mm": 70,
          "y_mm": 240,
          "field_type": "circle",
          "radius_mm": 3
        },
        {
          "label": "D",
          "x_mm": 90,
          "y_mm": 240,
          "field_type": "circle",
          "radius_mm": 3
        }
      ]
    },
    {
      "question_id": "Stack",
      "type": "multiple_choice",
      "page": 1,
      "answer_region": {
        "x_mm": 25,
        "y_mm": 255,
        "width_mm": 160,
        "height_mm": 20
      },
      "answer_fields": [
        {
          "label": "A",
          "x_mm": 30,
          "y_mm": 265,
          "field_type": "circle",
          "radius_mm": 3
        },
        {
          "label": "B",
          "x_mm": 50,
          "y_mm": 265,
          "field_type": "circle",
          "radius_mm": 3
        },
        {
          "label": "C",
          "x_mm": 70,
          "y_mm": 265,
          "field_type": "circle",
          "radius_mm": 3
        },
        {
          "label": "D",
          "x_mm": 90,
          "y_mm": 265,
          "field_type": "circle",
          "radius_mm": 3
        }
      ]
    }
  ],
  "fill_detection": {
    "threshold": 0.6,
    "noise_tolerance": "standard",
    "edge_detection": true
  }
}